name_ID,name_orig,name_orig_for_lookup,google_name,name_compare,brief_desc,image_url,image_source,detailed_desc,desc_source
500,"Morse, Samuel Finley Breese",Samuel Finley Breese Morse,Samuel Morse,FALSE,American inventor,https://encrypted-tbn1.gstatic.com/images?q=tbn:ANd9GcS4mkGuF8RBYN8iWivuPNEeHNSNf7Qkrx00dzjSL0sk9FGnXN-s,https://es.m.wikipedia.org/wiki/Archivo:Samuel_Morse_1840.jpg,"Samuel Finley Breese Morse was an American inventor and painter. After having established his reputation as a portrait painter, in his middle age Morse contributed to the invention of a single-wire telegraph system based on European telegraphs. ",https://en.wikipedia.org/wiki/Samuel_Morse
503,"Page, Patti",Patti Page,Patti Page,TRUE,American singer,https://encrypted-tbn3.gstatic.com/images?q=tbn:ANd9GcSzKkNesuhnBUopTk4Of3C9fN4WVGjL9zXnFkgHPUla9iSilG6I,https://commons.wikimedia.org/wiki/File:Patti_Page_1955.JPG,"Clara Ann Fowler, known by her stage name Patti Page, was an American singer of pop and country music and occasional actress. She was the top-charting female vocalist and best-selling female artist of the 1950s, selling over 100 million records during a six-decade long career. ",https://en.wikipedia.org/wiki/Patti_Page
504,"Perot, Ross",Ross Perot,Ross Perot 1992 presidential campaign,FALSE,Election campaign,https://encrypted-tbn1.gstatic.com/images?q=tbn:ANd9GcRoaqEy65Fee17LqJFyLeZa2cUGb_3l0no6sxR25ggUSIx_6ndc,https://en.wikipedia.org/wiki/Ross_Perot_1992_presidential_campaign,"In 1992, Ross Perot ran unsuccessfully as an independent candidate for President of the United States. Perot was a Texas industrialist who had never served as a public official, but he had experience as the head of several successful corporations and had been involved in public affairs for the previous three decades. ",https://en.wikipedia.org/wiki/Ross_Perot_1992_presidential_campaign
506,"Purdy, Amy",Amy Purdy,Amy Purdy,TRUE,American actress,https://encrypted-tbn3.gstatic.com/images?q=tbn:ANd9GcQyyt5l0TdE_Ztwxqyi-uDvI8VEnBKoRjWsK0SfcSmJE7banVi3,https://ar.wikipedia.org/wiki/%D9%85%D9%84%D9%81:Amy_Purdy_-_PopTech_2012_-_Narrow.jpg,"Amelia Michelle ""Amy"" Purdy is an American actress, model, para-snowboarder, motivational speaker, clothing designer and author. Purdy is a 2014 Paralympic bronze medalist, 2018 Paralympics silver medalist, and co-founder of Adaptive Action Sports.",https://en.wikipedia.org/wiki/Amy_Purdy
507,"Rauner, F. A.",F. A. Rauner,Bruce Rauner,FALSE,Former Governor of Illinois,https://encrypted-tbn0.gstatic.com/images?q=tbn:ANd9GcTP3KU6xtvlrb51k6OK-pxWUhkDbedm28ctO7ywrP2e1t5B65CD,https://commons.wikimedia.org/wiki/File:Bruce_Rauner_2016_cropped.jpg,"Bruce Vincent Rauner is an American businessman, philanthropist and politician who served as the 42nd governor of Illinois from 2015 to 2019. ",https://en.wikipedia.org/wiki/Bruce_Rauner
508,"Rejlander, Oscar Gustav",Oscar Gustav Rejlander,Oscar Gustave Rejlander,FALSE,Photographer,https://encrypted-tbn0.gstatic.com/images?q=tbn:ANd9GcTyiqQZYNofc9Es0kT1GeTpPpr9Hgop20S8k64b2i0UlmS6UF5G,"https://commons.wikimedia.org/wiki/File:Oscar_Gustave_Rejlander_(British,_born_Sweden_-_It_Won%27t_Rain_To-day_-_Google_Art_Project.jpg",Oscar Gustave Rejlander was a pioneering Victorian art photographer and an expert in photomontage. His collaboration with Charles Darwin on The Expression of the Emotions in Man and Animals has assured him a position in the history of behavioural science and psychiatry.,https://en.wikipedia.org/wiki/Oscar_Gustave_Rejlander
512,"Roosevelt, Eleanor",Eleanor Roosevelt,Eleanor Roosevelt,TRUE,Former First Lady of the United States,https://encrypted-tbn2.gstatic.com/images?q=tbn:ANd9GcQN1fVdS0559mIujbGF6fpUlQ9vFbMSa9SdzFhkWO7KxbLjr_LH,https://es.wikipedia.org/wiki/Archivo:Eleanor_Roosevelt_in_New_York_City_-_NARA_-_196282_(cropped).jpg,"Anna Eleanor Roosevelt was an American political figure, diplomat and activist. She served as the First Lady of the United States from March 4, 1933, to April 12, 1945, during her husband President Franklin D. ",https://en.wikipedia.org/wiki/Eleanor_Roosevelt
513,"Ruth, Babe",Babe Ruth,Babe Ruth,TRUE,American professional baseball player,https://encrypted-tbn3.gstatic.com/images?q=tbn:ANd9GcSAdTUoc3zMOLiTldwuBuueuSp825XhSSI6pFPNG57opGPPTtlt,"https://commons.wikimedia.org/wiki/File:Babe_Ruth_by_Paul_Thompson,_1920.jpg","George Herman ""Babe"" Ruth Jr. was an American professional baseball player whose career in Major League Baseball spanned 22 seasons, from 1914 through 1935. ",https://en.wikipedia.org/wiki/Babe_Ruth
515,"Schlafly, Phyllis",Phyllis Schlafly,Phyllis Schlafly,TRUE,Author,https://encrypted-tbn0.gstatic.com/images?q=tbn:ANd9GcQpf4JM9dtR2yA72Nycwdk46hYU4MQ30airSIl5IDtljb_UZtfz,https://commons.wikimedia.org/wiki/File:Phyllis_Schlafly_by_Gage_Skidmore.jpg,"Phyllis Stewart Schlafly was a movement conservative and author. She held conservative social and political views, opposed feminism and abortion, and successfully campaigned against ratification of the Equal Rights Amendment to the U.S. Constitution. ",https://en.wikipedia.org/wiki/Phyllis_Schlafly
516,"Schussele, Christian",Christian Schussele,Christian Schussele,TRUE,Artist,https://encrypted-tbn1.gstatic.com/images?q=tbn:ANd9GcT8BbtCL5eWlFup79bUEfMfkr3wFe3YjI10PULU4Krm06L93rUW,https://commons.wikimedia.org/wiki/File:Brooklyn_Museum_-_Study_for_Lesson_in_Charity_-_Christian_Schussele.jpg,"Christian Schussele was an American artist and teacher, and is credited with designing the American Medal of Honor. He studied under Adolphe Yvon and Paul Delaroche 1842â€“1848 and then came to the United States. ",https://en.wikipedia.org/wiki/Christian_Schussele
518,"Sousa, John Philip",John Philip Sousa,John Philip Sousa,TRUE,American composer,https://encrypted-tbn2.gstatic.com/images?q=tbn:ANd9GcScS9oh9axBq7YnFpKZrR5dEu9Vkv_pmJoNKJQ2bTtYGy3Qi0tK,"https://commons.wikimedia.org/wiki/File:John_Phillip_Sousa,_11-3-22_LOC_npcc.07285_(crop).jpg","John Philip Sousa was an American composer and conductor of the late Romantic era known primarily for American military marches. He is known as ""The March King"" or the ""American March King"", to distinguish him from his British counterpart Kenneth J. Alford. ",https://en.wikipedia.org/wiki/John_Philip_Sousa
520,"Stevenson II, Adlai E.",Adlai E. Stevenson II,Adlai Stevenson II,FALSE,Former Governor of Illinois,https://encrypted-tbn3.gstatic.com/images?q=tbn:ANd9GcTzNcIpUxHKWFooXIBMiDFOtG4jMSohQGbWrTK9YiCntNLQ7MYv,https://en.wikipedia.org/wiki/File:Adlai_E._Stevenson.jpg,"Adlai Ewing Stevenson II was an American lawyer, politician, and diplomat.
Raised in Bloomington, Illinois, Stevenson was a member of the Democratic Party. ",https://en.wikipedia.org/wiki/Adlai_Stevenson_II
521,"Terry, Gordon",Gordon Terry,Terry Sawchuk,FALSE,Ice hockey goaltender,https://encrypted-tbn1.gstatic.com/images?q=tbn:ANd9GcTXzU51dHqcUcwrGSD8x7x5fr7GFsbMCEPOrVHoUUrI5axoLXVH,https://lv.m.wikipedia.org/wiki/Att%C4%93ls:Terry_Sawchuk_1963.JPG,"Terrance Gordon Sawchuk was a Canadian professional ice hockey goaltender who played 21 seasons in the National Hockey League for the Detroit Red Wings, Boston Bruins, Toronto Maple Leafs, Los Angeles Kings and the New York Rangers. ",https://en.wikipedia.org/wiki/Terry_Sawchuk
522,"Thorpe, Jim",Jim Thorpe,Jim Thorpe,TRUE,Athlete,https://encrypted-tbn1.gstatic.com/images?q=tbn:ANd9GcTnTIIV7rhxEk4lWbDCoA85l_Wc97Owna-atuIlB1-tvbtnahCu,https://commons.wikimedia.org/wiki/File:Jim_Thorpe_Canton_Bulldogs_1915-20.jpg,"James Franciscus Thorpe was an American athlete and Olympic gold medalist. A member of the Sac and Fox Nation, Thorpe became the first Native American to win a gold medal for the United States. ",https://en.wikipedia.org/wiki/Jim_Thorpe
524,"Washington, Martha",Martha Washington,Martha Washington,TRUE,Former First Lady of the United States,https://encrypted-tbn2.gstatic.com/images?q=tbn:ANd9GcQTrcQJAhpSFt5H4FfUQJs08LQ2-dvFpmFg7quENl8DYtVokiMY,https://commons.wikimedia.org/wiki/File:Martha_washington.jpg,"Martha Washington was the wife of George Washington, the first President of the United States. Although the title was not coined until after her death, Martha Washington served as the inaugural First Lady of the United States. ",https://en.wikipedia.org/wiki/Martha_Washington
525,"Watson, Joseph",Joseph Watson,Earl Watson,FALSE,Basketball coach,https://encrypted-tbn2.gstatic.com/images?q=tbn:ANd9GcQGWR6aQ0YoBCAL2LqrS-SNd2lxxxdOHJs5GXIY-lyAmYHX1GyK,https://en.wikipedia.org/wiki/Earl_Watson,"Earl Joseph Watson Jr. is an American professional basketball coach and former player in the National Basketball Association. He played college basketball for the UCLA Bruins, where he was a four-year starter and named all-conference as a senior in the Pac-10. ",https://en.wikipedia.org/wiki/Earl_Watson
526,"Zapata, Emiliano",Emiliano Zapata,Emiliano InsÃºa,FALSE,Footballer,https://encrypted-tbn3.gstatic.com/images?q=tbn:ANd9GcRQgYQFyiq8BycbT4SSuigMyw3nLQ0OzFI1EuvAzdfSxMPNStqM,https://en.wikipedia.org/wiki/Emiliano_Ins%C3%BAa,"Emiliano AdriÃ¡n InsÃºa Zapata is an Argentine footballer who plays as a left back for MLS club LA Galaxy.
InsÃºa is a citizen of the European Union through one of his grandparents, who is Spanish.",https://en.wikipedia.org/wiki/Emiliano_Ins%C3%BAa
530,"Bradley, Stuart",Stuart Bradley,Brad Stuart,FALSE,Ice hockey defenceman,https://encrypted-tbn1.gstatic.com/images?q=tbn:ANd9GcSSx6uE569AH7dIr176IcUel0xxliKJiHix6B8snsjnURIp72LU,https://en.wikipedia.org/wiki/Brad_Stuart,"Bradley Stuart is a Canadian former professional ice hockey defenceman who played in over 1,000 career games in the National Hockey League. Stuart was a member of the Stanley Cup-winning 2007â€“08 Detroit Red Wings.",https://en.wikipedia.org/wiki/Brad_Stuart
532,"Brigman, Anne W.",Anne W. Brigman,Anne Brigman,FALSE,American photographer,https://encrypted-tbn3.gstatic.com/images?q=tbn:ANd9GcSF3hHE5OAXjFBmhXN6HZegVtBwV1rr2aEHPON1_0niMnYGRlKt,https://en.wikipedia.org/wiki/Anne_Brigman,"Anne Wardrope Brigman was an American photographer and one of the original members of the Photo-Secession movement in America.
Her most famous images were taken between 1900 and 1920, and depict nude women in primordial, naturalistic contexts.",https://en.wikipedia.org/wiki/Anne_Brigman
534,"Browning, John M.",John M. Browning,John Browning,FALSE,,https://encrypted-tbn1.gstatic.com/images?q=tbn:ANd9GcT3MM9SLY7m7bzyPthH6R2ub2lSB4WBqyhDJ4Hqi5_29Lv4u5Rw,https://commons.wikimedia.org/wiki/File:John_M._Browning_with_his_Auto_5_shotgun_(3).png,"John Moses Browning was an American firearms designer who developed many varieties of military and civilian firearms, cartridges, and gun mechanisms â€“ many of which are still in use around the world. ",https://en.wikipedia.org/wiki/John_Browning
536,"Cassini, Oleg",Oleg Cassini,Oleg Cassini,TRUE,Fashion designer,https://encrypted-tbn2.gstatic.com/images?q=tbn:ANd9GcT-C6DXKRRq6Bw36GIeef7Ib103wdIITT1P7tdFoSXxPCIrrbIS,https://commons.wikimedia.org/wiki/File:Oleg_Cassini_1955.jpg,"Oleg Cassini was an American fashion designer born to an aristocratic Russian family with maternal Italian ancestry. He came to the United States as a young man after starting as a designer in Rome, and quickly got work with Paramount Pictures. ",https://en.wikipedia.org/wiki/Oleg_Cassini
538,"Delaroche, Paul",Paul Delaroche,Paul Delaroche,TRUE,French painter,https://encrypted-tbn3.gstatic.com/images?q=tbn:ANd9GcSXZ7NtPT1IUlJZ8VXwNMzG8N2GQdyCG0hSoVhKqKnGAbB0uMkW,https://commons.wikimedia.org/wiki/File:Delaroche_autoportrait_fusain_1838.jpg,Paul Delaroche was a French painter who achieved his greater successes painting historical scenes. He became famous in Europe for his melodramatic depictions that often portrayed subjects from English and French history. ,https://en.wikipedia.org/wiki/Paul_Delaroche
539,"Dwight, Ed",Ed Dwight,Elton John,FALSE,Singer-songwriter,https://encrypted-tbn0.gstatic.com/images?q=tbn:ANd9GcR2hUhxnxMTYe7xTpbiImE0aMvkk_bscBu47KDWM6WY6DAND9a0,https://commons.wikimedia.org/wiki/File:Elton_John_November_2015.jpg,"Sir Elton Hercules John CH CBE is an English singer, songwriter, pianist, and composer. Collaborating with lyricist Bernie Taupin since 1967 on more than 30 albums, John has sold more than 300 million records, making him one of the best-selling music artists of all time. ",https://en.wikipedia.org/wiki/Elton_John
540,"Eisenhower, Mamie",Mamie Eisenhower,Mamie Eisenhower,TRUE,Former First Lady of the United States,https://encrypted-tbn1.gstatic.com/images?q=tbn:ANd9GcRIXO8nwILpTMLGK6BMsptfRTdM0XKiAUWyLSEdMbVfdY2jG_03,https://en.wikipedia.org/wiki/File:Mamie_eisenhower.gif,"Mamie Geneva Eisenhower was the wife of President Dwight D. Eisenhower and thereby First Lady of the United States from 1953 to 1961.
Mamie married Dwight Eisenhower at age 19 in 1916. The young couple moved frequently between military quarters in many postings, from Panama to the Philippines. ",https://en.wikipedia.org/wiki/Mamie_Eisenhower
541,"Fitzgerald, Jr., J. O.",J. O. Jr. Fitzgerald,John F. Kennedy,FALSE,35th U.S. President,https://encrypted-tbn3.gstatic.com/images?q=tbn:ANd9GcRNNBRT_dbLTvAMY7qjUobyJLbC_rL42KCVDL46Ia_56uVvV_20,"https://commons.wikimedia.org/wiki/File:John_F._Kennedy,_White_House_color_photo_portrait.jpg","John Fitzgerald Kennedy, often referred to by his initials JFK and Jack, was an American politician who served as the 35th president of the United States from January 1961 until his assassination in November 1963. ",https://en.wikipedia.org/wiki/John_F._Kennedy
542,"Ford, Betty",Betty Ford,Betty Ford,TRUE,Former First Lady of the United States,https://encrypted-tbn1.gstatic.com/images?q=tbn:ANd9GcRDn62239pgZdF4JrbtcM77Eyp4Ooan2kEnQqLiJejUOn621Zse,"https://commons.wikimedia.org/wiki/File:Betty_Ford,_official_White_House_photo_color,_1974_(cropped).jpg","Elizabeth Anne Ford was the First Lady of the United States from 1974 to 1977, as the wife of President Gerald Ford. As First Lady, she was active in social policy and set a precedent as a politically active presidential spouse. ",https://en.wikipedia.org/wiki/Betty_Ford
544,"French, J. A.",J. A. French,French language,FALSE,Spoken language,https://encrypted-tbn1.gstatic.com/images?q=tbn:ANd9GcStSiCMb4OO8j4W5hBgrofzQiuSFIw2V85rc6O5Zwr7Ehf3MR3r,https://commons.wikimedia.org/wiki/File:Distribution_map_of_the_French_language_in_Europe.png,"French is a Romance language of the Indo-European family. It descended from the Vulgar Latin of the Roman Empire, as did all Romance languages. French evolved from Gallo-Romance, the Latin spoken in Gaul, and more specifically in Northern Gaul. ",https://en.wikipedia.org/wiki/French_language
546,"Galanos, James",James Galanos,James Galanos,TRUE,American fashion designer,https://encrypted-tbn0.gstatic.com/images?q=tbn:ANd9GcRSNEE8zaGP7v_R4r1_wJWP1GdXy4EnMeh1wbXGOBZzFK_OQM7t,https://en.wikipedia.org/wiki/James_Galanos,James Galanos was an American fashion designer and couturier.,https://en.wikipedia.org/wiki/James_Galanos
549,"Hamlin, Hannibal",Hannibal Hamlin,Hamlin Garland,FALSE,American novelist,https://encrypted-tbn1.gstatic.com/images?q=tbn:ANd9GcSpnITI94ToOM3KIFyEf8OGnqeK4wnJK0KAUQPG-ML9FTEyZvOT,https://commons.wikimedia.org/wiki/File:Portrait_of_Hamlin_Garland.jpg,"Hannibal Hamlin Garland was an American novelist, poet, essayist, short story writer, Georgist, and psychical researcher. He is best known for his fiction involving hard-working Midwestern farmers.",https://en.wikipedia.org/wiki/Hamlin_Garland
550,"Harris, Carlyle",Carlyle Harris,Carlyle Harris,TRUE,,https://encrypted-tbn0.gstatic.com/images?q=tbn:ANd9GcQM1CT7JpdMuPGSPFVdv1q_FALtISpNUcbgbbCOpYKEHpi3aZZM,https://en.wikipedia.org/wiki/Carlyle_Harris,"Carlyle Harris was a medical student who was convicted and sentenced to death for the murder of his wife.
A student at New York College of Physicians and Surgeons, Harris murdered his wife, Mary Helen Potts, whom he had married on February 8, 1890, with an overdose of morphine in the form of sleeping pills. ",https://en.wikipedia.org/wiki/Carlyle_Harris
553,"Hope, Bob",Bob Hope,Bob Hope,TRUE,American-British comedian,https://encrypted-tbn2.gstatic.com/images?q=tbn:ANd9GcTe33AAewGdKbMaZG6_ZR--HHocLEw4cHhEB-f-uDgJaTmPorJa,"https://ar.m.wikipedia.org/wiki/%D9%85%D9%84%D9%81:Bob_Hope,_1978.jpg","Leslie Townes ""Bob"" Hope KBE KC*SG, KSS was a British-American stand-up comedian, vaudevillian, actor, singer, dancer, and author. ",https://en.wikipedia.org/wiki/Bob_Hope
554,"Ittenbach, Franz",Franz Ittenbach,Franz Ittenbach,TRUE,German painter,https://encrypted-tbn0.gstatic.com/images?q=tbn:ANd9GcTeicKOyxLsn8lGYIK0RSeMgciezF1lejt7GeTUVQDt5mR94Ggr,https://commons.wikimedia.org/wiki/File:Franz_Ittenbach_1813-1879_-_Mater_Amabilis.jpg,"Franz Ittenbach was a German religious painter from KÃ¶nigswinter, at the foot of the Drachenfels.
Ittenbach began his art education as a student of Kaufmann, then left to study under Franz Katz in Cologne. ",https://en.wikipedia.org/wiki/Franz_Ittenbach
555,"Johnson, Adelaide",Adelaide Johnson,Adelaide Johnson,TRUE,American sculptor,https://encrypted-tbn1.gstatic.com/images?q=tbn:ANd9GcQpwGXV0ROGPFrRLQYcVkNQPSZ4VDM1yEcH_rn4Iy2Na0L1T9K1,https://commons.wikimedia.org/wiki/File:Flickr_-_USCapitol_-_Adelaide_Johnson_(1846-1955)_-_Women_Artists.jpg,"Adelaide Johnson was an American sculptor whose work is displayed in the U.S. Capitol and a feminist who was devoted to the cause of equality of women. She was known as the ""sculptor of the women's movement"".",https://en.wikipedia.org/wiki/Adelaide_Johnson
558,"Keck, Charles",Charles Keck,Charles Keck,TRUE,,https://encrypted-tbn2.gstatic.com/images?q=tbn:ANd9GcTLSNPwjqS5hZv7k844v_aa4cAdpnqWGakbZoBbdUNxz-N9kY3W,https://commons.wikimedia.org/wiki/File:Young_Lincoln_by_Charles_Keck.JPG,"Charles Keck was an American sculptor from New York City, New York.",https://en.wikipedia.org/wiki/Charles_Keck
561,"Lodge, Henry Cabot",Henry Cabot Lodge,Henry Cabot Lodge,TRUE,Former United States Senator,https://encrypted-tbn3.gstatic.com/images?q=tbn:ANd9GcSynKqS7qDx3wfrIw0Q0iJedcGGRd5qGBuY5V9nQ6cifh3G9Qhu,https://commons.wikimedia.org/wiki/File:Henry_Cabot_Lodge_cph.3a38855.jpg,"Henry Cabot Lodge was an American Republican politician, historian, and statesman from Massachusetts. He served in the United States Senate from 1893 to 1924 and is best known for his positions on foreign policy. ",https://en.wikipedia.org/wiki/Henry_Cabot_Lodge
562,"Lunceford, Jimmie",Jimmie Lunceford,Jimmie Lunceford,TRUE,American saxophonist,https://encrypted-tbn1.gstatic.com/images?q=tbn:ANd9GcQLXkSXtYnkkGElD1CKlJEIPyUOv9HV0jof3L0ivq7AOJ9ya1Vo,https://en.wikipedia.org/wiki/Jimmie_Lunceford,James Melvin Lunceford was an American jazz alto saxophonist and bandleader in the swing era.,https://en.wikipedia.org/wiki/Jimmie_Lunceford
563,"MacDonald, Pirie",Pirie MacDonald,Pirie MacDonald,TRUE,American photographer,https://encrypted-tbn1.gstatic.com/images?q=tbn:ANd9GcS_sAk-w90dETgktMpt89cwBCtXXH4mR5n_icDhX1sYF0a0nZVv,https://commons.wikimedia.org/wiki/File:Theodore_Roosevelt_by_Pirie_MacDonald_cph.3a14467.jpg,"Ian Pirie MacDonald was an American portrait photographer, New York City civic leader, and peace advocate. He photographed over 70,000 men in the span of his career, including international heads of state, religious leaders, and artists.",https://en.wikipedia.org/wiki/Pirie_MacDonald
564,"Marigny, Marquis de",Marquis de Marigny,Abel-FranÃ§ois Poisson,FALSE,,https://encrypted-tbn2.gstatic.com/images?q=tbn:ANd9GcRJfyuaD_V7h2qPPTb4bzD2YHoyvRTslo7LzbnEl4pzUu0LtlGQ,https://en.wikipedia.org/wiki/Abel-Fran%C3%A7ois_Poisson,"Abel-FranÃ§ois Poisson de VandiÃ¨res, marquis de Marigny and marquis de Menars, often referred to simply as marquis de Marigny, was a French nobleman who served as the director general of the King's Buildings. ",https://en.wikipedia.org/wiki/Abel-Fran%C3%A7ois_Poisson
565,"Mather, Margrethe",Margrethe Mather,Margrethe Mather,TRUE,American photographer,https://encrypted-tbn3.gstatic.com/images?q=tbn:ANd9GcR3BX2O8DR25J01mXG4sbCgnEHxVIHRLkJwJ6dpk2Gmp0vQ4UlY,https://commons.wikimedia.org/wiki/File:Alice_Terry_portrait_by_Margrethe_Mather.jpg,"Margrethe Mather was an American photographer. She was one of the best known female photographers of the early 20th century. Initially she influenced and was influenced by Edward Weston while working in the pictorial style, but she independently developed a strong eye for patterns and design that transformed some of her photographs into modernist abstract art. ",https://en.wikipedia.org/wiki/Margrethe_Mather
567,"McKinley, Ida Saxton",Ida Saxton McKinley,Ida Saxton McKinley,TRUE,Former First Lady of the United States,https://encrypted-tbn1.gstatic.com/images?q=tbn:ANd9GcTkke36K63HsPOIN1HqrT0lwRzN0235jwrr1BbjeM2DPDWaHvDN,https://commons.wikimedia.org/wiki/File:ISMcKinley.jpg,Ida McKinley was the First Lady of the United States from 1897 until 1901.,https://en.wikipedia.org/wiki/Ida_Saxton_McKinley
568,"Michel, Jean Baptiste",Jean Baptiste Michel,Jean-Baptiste Lully,FALSE,French-Italian composer,https://encrypted-tbn2.gstatic.com/images?q=tbn:ANd9GcSUeUqiilaeRuxjJYZcmfajbYggRIbHLF2vxDDtR1ibBXTMY5Ig,https://cs.m.wikipedia.org/wiki/Soubor:Paul_Mignard_-_Jean-Baptiste_Lully.jpg,"Jean-Baptiste Lully was an Italian-born French composer, instrumentalist, and dancer who spent most of his life working in the court of Louis XIV of France. He is considered a master of the French Baroque style. Lully disavowed any Italian influence in French music of the period. He became a French subject in 1661.",https://en.wikipedia.org/wiki/Jean-Baptiste_Lully
569,"Moss, Elisabeth",Elisabeth Moss,Elisabeth Moss,TRUE,Actor,https://encrypted-tbn0.gstatic.com/images?q=tbn:ANd9GcS7vzD20S_sUhY4B9vzm6ECGbtTe93p63lSu29274yT8ZA6ejQq,https://commons.wikimedia.org/wiki/File:Elisabeth_Moss_LF.jpg,"Elisabeth Singleton Moss is an American actor and producer. She has received numerous accolades, including two Primetime Emmy Awards and two Golden Globe Awards. Her extensive television work led Vulture to name her the ""Queen of Peak TV"".
",https://en.wikipedia.org/wiki/Elisabeth_Moss
571,"North, Oliver",Oliver North,Oliver North,TRUE,American commentator,https://encrypted-tbn2.gstatic.com/images?q=tbn:ANd9GcQTGQEGO_rRVow1uuIhuchj2lihzuf7xDccgw_0SmFazJwag3V7,https://commons.wikimedia.org/wiki/File:Oliver_North_by_Gage_Skidmore.jpg,"Oliver Laurence North is an American political commentator, television host, military historian, author, and retired United States Marine Corps lieutenant colonel.
",https://en.wikipedia.org/wiki/Oliver_North
574,"Parker, Fess",Fess Parker,Fess Parker,TRUE,American film actor,https://encrypted-tbn2.gstatic.com/images?q=tbn:ANd9GcQqGj5SA6EZ2bj_AReDsno-icUrsFcBnGjtr460lSx-tpQsdzYS,https://commons.wikimedia.org/wiki/File:Fess_Parker_1968.JPG,"Fess Elisha Parker Jr., was an American film and television actor best known for his portrayals of Davy Crockett in the Walt Disney 1954â€“1955 TV miniseries, which aired on ABC, and as Daniel Boone in an NBC television series from 1964 to 1970. ",https://en.wikipedia.org/wiki/Fess_Parker
575,"Parks, Rosa",Rosa Parks,Rosa Parks,TRUE,American activist,https://encrypted-tbn0.gstatic.com/images?q=tbn:ANd9GcTJ3c5kSdZ53KCBCAbgxKjWPsP3RQpBmUrn39zSTBSwmNh_MWwC,https://commons.wikimedia.org/wiki/File:Rosaparks.jpg,Rosa Louise McCauley Parks was an American activist in the civil rights movement best known for her pivotal role in the Montgomery bus boycott. ,https://en.wikipedia.org/wiki/Rosa_Parks
576,"Penn, Irving",Irving Penn,Irving Penn,TRUE,American photographer,https://encrypted-tbn0.gstatic.com/images?q=tbn:ANd9GcTNzNufjdop-D8uaNm1dqXNMYneNZnfqbxvIDWDqyDOGKQJt5qW,https://commons.wikimedia.org/wiki/File:Polacek_penn_simanek_1986_prague.jpg,"Irving Penn was an American photographer known for his fashion photography, portraits, and still lifes. Penn's career included work at Vogue magazine, and independent advertising work for clients including Issey Miyake and Clinique. ",https://en.wikipedia.org/wiki/Irving_Penn
577,"Perkins, Helen K.",Helen K. Perkins,Helen Keller,FALSE,American author,https://encrypted-tbn2.gstatic.com/images?q=tbn:ANd9GcRqaGCXFSjVv8I-ctEHwM6GvmPCqrExVHLMsh6hJenxua1yDubT,https://en.wikipedia.org/wiki/File:Helen_KellerA.jpg,"Helen Adams Keller was an American author, political activist, and lecturer. She was the first deaf-blind person to earn a Bachelor of Arts degree. ",https://en.wikipedia.org/wiki/Helen_Keller
578,"Pierce, Franklin",Franklin Pierce,Franklin Pierce,TRUE,14th U.S. President,https://encrypted-tbn2.gstatic.com/images?q=tbn:ANd9GcSd7bpG4FKmDJMN1c_mDJOFGedpw5ju-Ft2q8LG4l4D6UnOZ1yl,https://commons.wikimedia.org/wiki/File:Franklin_pierce3.jpg,"Franklin Pierce was the 14th president of the United States, a northern Democrat who saw the abolitionist movement as a fundamental threat to the unity of the nation. ",https://en.wikipedia.org/wiki/Franklin_Pierce
580,"Pollack, Stanley M.",Stanley M. Pollack,Tom Cruise,FALSE,American actor,https://encrypted-tbn3.gstatic.com/images?q=tbn:ANd9GcT7s6OaI1c58sHBAxxzWsJSZceVBPMdKo6_ZIbPWmRptW-0RDwb,https://commons.wikimedia.org/wiki/File:Tom_Cruise_by_Gage_Skidmore_2.jpg,"Thomas Cruise Mapother IV is an American actor and producer. He has received various accolades for his work, including three Golden Globe Awards and three nominations for Academy Awards. ",https://en.wikipedia.org/wiki/Tom_Cruise
