name_ID,name_orig,name_orig_for_lookup,google_name,name_compare,brief_desc,image_url,image_source,detailed_desc,desc_source
327,"Symington, Stuart",Stuart Symington,Stuart Symington,TRUE,Former United States Senator,https://encrypted-tbn3.gstatic.com/images?q=tbn:ANd9GcQBA4BGPZUKrj0L2izNJC0RKN91emN_rYsW6OBaI3I7Nksg15Z0,https://en.wikipedia.org/wiki/Stuart_Symington,"William Stuart Symington Jr. was an American businessman and Democratic politician from Missouri. He served as the first Secretary of the Air Force from 1947 to 1950 and was a United States Senator from Missouri from 1953 to 1976.
",https://en.wikipedia.org/wiki/Stuart_Symington
329,"Brady, Mathew B.",Mathew B. Brady,Mathew Brady,FALSE,American photographer,https://encrypted-tbn1.gstatic.com/images?q=tbn:ANd9GcSTifgMwusqrA4992_Nt33Q-AgSg3Z8ZvfiMY9bzLPjY0uc0dXR,https://commons.wikimedia.org/wiki/File:Mathew_Brady_1875_cropped.jpg,"Mathew B. Brady was an American photographer, and one of the earliest in American history. Best known for his scenes of the Civil War, he studied under inventor Samuel F. B. Morse, who pioneered the daguerreotype technique in America. ",https://en.wikipedia.org/wiki/Mathew_Brady
330,"Clark, James J.",James J. Clark,James Morrison,FALSE,Footballer,https://encrypted-tbn1.gstatic.com/images?q=tbn:ANd9GcTAcTYKg2jpuA-BjaHzmgWVibbBFFZtP0f7EqXAGPzOfdg1E2l3,https://en.wikipedia.org/wiki/James_Morrison_(footballer),"James Clark Morrison is a former professional footballer who played as a midfielder for Middlesbrough and West Bromwich Albion. After representing various England junior sides, Morrison chose to play for Scotland at full international level.",https://en.wikipedia.org/wiki/James_Morrison_(footballer)
331,"Crane, Margaret",Margaret Crane,Margaret Crane,TRUE,American inventor,https://encrypted-tbn0.gstatic.com/images?q=tbn:ANd9GcRyD-xfIjzw5MkpI21Kvfa0Kyzf0uDwCZm2QHduuuMOesV86ll1,"https://commons.wikimedia.org/wiki/File:Patent_for_home_pregnancy_test_(US3579306),_by_Margaret_Crane.png","Margaret M. Crane is an American inventor and graphic designer who lives in New York. Crane created the first at home pregnancy test in 1967 while working at Organon in West Orange, New Jersey. ",https://en.wikipedia.org/wiki/Margaret_Crane
333,"Durer, Albrecht",Albrecht Durer,Albrecht DÃ¼rer,FALSE,German painter,https://encrypted-tbn0.gstatic.com/images?q=tbn:ANd9GcSQ0c5nC-3XAPM8yoTkYHIa7yxg3mekJRdU0n0AHlzZjtLr0qWu,https://commons.wikimedia.org/wiki/File:Albrecht_D%C3%BCrer_-_1500_self-portrait_(High_resolution_and_detail).jpg,"Albrecht DÃ¼rer, sometimes spelt in English as Durer or Duerer, was a German painter, printmaker, and theorist of the German Renaissance. ",https://en.wikipedia.org/wiki/Albrecht_D%C3%BCrer
334,"Gardener, Helen H.",Helen H. Gardener,Helen H. Gardener,TRUE,Author,https://encrypted-tbn2.gstatic.com/images?q=tbn:ANd9GcQfz8-JB57pwLjSskro3hkLBaCSLYoyvM4JuYt8cQHXBngqwxGu,https://en.wikipedia.org/wiki/Helen_H._Gardener,"Helen Hamilton Gardener, born Alice Chenoweth, was an American author, rationalist public intellectual, political activist, and government functionary. ",https://en.wikipedia.org/wiki/Helen_H._Gardener
335,"Gutekunst, Frederic",Frederic Gutekunst,Frederick Gutekunst,FALSE,American photographer,https://encrypted-tbn2.gstatic.com/images?q=tbn:ANd9GcQvFYcLzFV-snf8IPzVXvgbvImp-rHxtvb62Ul6qnzYgWARt2Vv,https://en.wikipedia.org/wiki/Frederick_Gutekunst,Frederick Gutekunst was an American photographer. His photographic career started in 1856 in Philadelphia and his business grew during the Civil War. ,https://en.wikipedia.org/wiki/Frederick_Gutekunst
336,"Holmes, William Henry",William Henry Holmes,Henry Cavill,FALSE,British actor,https://encrypted-tbn3.gstatic.com/images?q=tbn:ANd9GcQvQKVwFz6bCypk0tfHYh83xPu6CHKkRVReLdWx6nbDINzVw1hR,https://commons.wikimedia.org/wiki/File:Henry_Cavill_by_Gage_Skidmore.jpg,"Henry William Dalgliesh Cavill is an English actor. He is best known for his portrayal of the DC Comics character Superman in the DC Extended Universe, as well as Geralt of Rivia in the Netflix fantasy series The Witcher.
",https://en.wikipedia.org/wiki/Henry_Cavill
340,"Lindbergh, Charles A.",Charles A. Lindbergh,Charles Lindbergh,FALSE,American aviator,https://encrypted-tbn2.gstatic.com/images?q=tbn:ANd9GcRItQDX0HrivsLp-BQ-NVzG5AEEL7bXEjYG3nutGL5lPqPlRsk-,https://es.m.wikipedia.org/wiki/Archivo:Col_Charles_Lindbergh.jpg,"Charles Augustus Lindbergh was an American aviator, military officer, author, inventor, and activist. At the age of 25 in 1927, he went from obscurity as a U.S. ",https://en.wikipedia.org/wiki/Charles_Lindbergh
341,"Mackey, Lance",Lance Mackey,Lance Mackey,TRUE,,https://encrypted-tbn2.gstatic.com/images?q=tbn:ANd9GcQ8AwdXYDIQF9L_J4jcYt3s1HPdZYZbkWfMtgye0dKElQ9r-UHX,"https://commons.wikimedia.org/wiki/File:Lance_Mackey,_after_finishing_2010_Iditarod_(4445733979).jpg","Lance Mackey is an American dog musher and dog sled racer from Fairbanks, Alaska, who is a four-time winner of the 1,000-mile Yukon Quest and four-time winner of the Iditarod Trail Sled Dog Race.",https://en.wikipedia.org/wiki/Lance_Mackey
342,"Moholy-Nagy, Laszlo",Laszlo Moholy-Nagy,LÃ¡szlÃ³ Moholy-Nagy,FALSE,Hungarian painter,https://encrypted-tbn0.gstatic.com/images?q=tbn:ANd9GcQmjfbpy-mcMo6LZrjAts0cruHaF673Z4cdKcGmd2NUDEKaVo5z,"https://de.wikipedia.org/wiki/Datei:L%C3%A1szl%C3%B3_Moholy-Nagy_by_Hugo_Erfurth,_c._1930_.jpg",LÃ¡szlÃ³ Moholy-Nagy was a Hungarian painter and photographer as well as a professor in the Bauhaus school. He was highly influenced by constructivism and a strong advocate of the integration of technology and industry into the arts. ,https://en.wikipedia.org/wiki/L%C3%A1szl%C3%B3_Moholy-Nagy
344,"Poussin, Nicolas",Nicolas Poussin,Nicolas Poussin,TRUE,Painter,https://encrypted-tbn1.gstatic.com/images?q=tbn:ANd9GcTKdwldqyutlFWJb24Xn2PhUnj2MgmHI8Jxe-QNyQiJRxG1F4PG,https://commons.wikimedia.org/wiki/File:Nicolas_Poussin_078.jpg,"Nicolas Poussin was the leading painter of the classical French Baroque style, although he spent most of his working life in Rome. Most of his works were on religious and mythological subjects painted for a small group of Italian and French collectors. ",https://en.wikipedia.org/wiki/Nicolas_Poussin
346,"Ritchie, Jean",Jean Ritchie,Jean Ritchie,TRUE,American singer-songwriter,https://encrypted-tbn2.gstatic.com/images?q=tbn:ANd9GcRYSjRrlqGGFOmx4sDk3Qq5UUbEfpLo4Tt5GmnFJYL0pj8VoWkS,https://en.wikipedia.org/wiki/Jean_Ritchie,"Jean Ruth Ritchie was an American folk music singer, songwriter, and Appalachian dulcimer player. Her career bridged traditional and modern forms of folk music. ",https://en.wikipedia.org/wiki/Jean_Ritchie
348,"Van Buren, Martin",Martin Van Buren,Martin Van Buren,TRUE,8th U.S. President,https://encrypted-tbn2.gstatic.com/images?q=tbn:ANd9GcThMcVzn4e87DI-yxvBj-88piBfTBH89_CsE-oB-_Zln3lF8Uzc,https://en.wikipedia.org/wiki/File:Martin_Van_Buren_by_Mathew_Brady_c1855-58.jpg,"Martin Van Buren was an American statesman who served as the eighth president of the United States from 1837 to 1841. A founder of the Democratic Party, he had previously served as the ninth governor of New York, the tenth United States secretary of state, and the eighth vice president of the United States. ",https://en.wikipedia.org/wiki/Martin_Van_Buren
350,"Waters, Asa",Asa Waters,Asa Waters Mansion,FALSE,"Mansion in Millbury, Massachusetts",https://encrypted-tbn0.gstatic.com/images?q=tbn:ANd9GcQs1smS8IMz-4ljVDQPxZuSVd94PZC3BiNHsvID5kRDBvrqkbvO,https://en.wikipedia.org/wiki/Asa_Waters_Mansion,"The Asa Waters Mansion is an historic mansion at 123 Elm Street in Millbury, Massachusetts. Recently restored, it is now available for weddings and private functions. ",https://en.wikipedia.org/wiki/Asa_Waters_Mansion
351,"Barkley, Alben William",Alben William Barkley,Alben W. Barkley,FALSE,Former Vice President of the United States,https://encrypted-tbn1.gstatic.com/images?q=tbn:ANd9GcQE3L-4fKJ6F3ZisQ5uWVlCbCYf4eW7txgEwqQxC46_2h7BsGln,https://ja.m.wikipedia.org/wiki/%E3%83%95%E3%82%A1%E3%82%A4%E3%83%AB:35_Alben_Barkley_3x4.jpg,"Alben William Barkley was an American lawyer and politician from Kentucky who served in both houses of Congress and as the 35th vice president of the United States from 1949 to 1953. In 1905, he was elected county attorney for McCracken County, Kentucky. ",https://en.wikipedia.org/wiki/Alben_W._Barkley
352,"Capa, Robert",Robert Capa,Boyd Holbrook,FALSE,American actor,https://encrypted-tbn3.gstatic.com/images?q=tbn:ANd9GcSrKtg2JQseynCRCoVno4nRsEOHEjvRoLk2ZrgCykimu1IjFke9,https://commons.wikimedia.org/wiki/File:Boyd_Holbrook_(40061613100).jpg,"Robert Boyd Holbrook is an American actor and model. He has appeared in films such as Milk, Out of the Furnace, Run All Night, A Walk Among the Tombstones and Gone Girl, and starred as DEA agent Steve Murphy in the Netflix series Narcos. ",https://en.wikipedia.org/wiki/Boyd_Holbrook
353,"Clay, Henry",Henry Clay,Henry Clay,TRUE,Former American senator,https://encrypted-tbn2.gstatic.com/images?q=tbn:ANd9GcT0Qq2AyCFWo_9WbWKPkRvQp15Ji2o02_4LjUXWypZAF5XV2dTC,https://commons.wikimedia.org/wiki/File:Henry_Clay_1848_restored.jpg,Henry Clay Sr. was an American attorney and statesman who represented Kentucky in both the Senate and House. He was the seventh House Speaker and the ninth Secretary of State. ,https://en.wikipedia.org/wiki/Henry_Clay
354,"Corliss, George H.",George H. Corliss,George Henry Corliss,FALSE,American mechanical engineer,https://encrypted-tbn3.gstatic.com/images?q=tbn:ANd9GcSkKdq49fYvoiyEurh2-hmtzucQs9FjqdBJ0MzSpbKBVztAXq1d,https://en.wikipedia.org/wiki/George_Henry_Corliss,"George Henry Corliss was an American mechanical engineer and inventor, who developed the Corliss steam engine, which was a great improvement over any other stationary steam engine of its time. ",https://en.wikipedia.org/wiki/George_Henry_Corliss
355,"Dayton, William L.",William L. Dayton,William L. Dayton,TRUE,Former United States Senator,https://encrypted-tbn1.gstatic.com/images?q=tbn:ANd9GcRHVrVZyTtWaf81dEE-O_220-QZdLvEIE-y9UjVQoAmqbrpBNMQ,https://en.wikipedia.org/wiki/William_L._Dayton,"William Lewis Dayton was an American politician, active first in the Whig Party and later in the Republican Party. In the 1856 presidential election, he became the first Republican vice-presidential nominee when nominated alongside John C. FrÃ©mont. ",https://en.wikipedia.org/wiki/William_L._Dayton
358,"Fillmore, Millard",Millard Fillmore,Millard Powers Fillmore,FALSE,Lawyer,https://encrypted-tbn1.gstatic.com/images?q=tbn:ANd9GcT1vkEMxY8QQ9dr6tLSi-vLGrHrJSi4mECB0VAw8CFUBiB_Eyyt,https://commons.wikimedia.org/wiki/File:Millard_Powers_Fillmore_(Son_of_President_Millard_Fillmore).jpg,"Millard Powers Fillmore was a lawyer and one of two children, and only son, of US President Millard Fillmore and his first wife, Abigail Powers.",https://en.wikipedia.org/wiki/Millard_Powers_Fillmore
360,"King, Victoria",Victoria King,Roger Federer,FALSE,Tennis player,https://encrypted-tbn1.gstatic.com/images?q=tbn:ANd9GcTn9wSbmeA0nYMi9mhxPj9xgKpw-uXWkhdm1bVFa795qn_Am4Ec,https://en.wikipedia.org/wiki/Roger_Federer,Roger Federer is a Swiss professional tennis player who is ranked world No. 4 in men's singles tennis by the Association of Tennis Professionals. ,https://en.wikipedia.org/wiki/Roger_Federer
362,"McClellan, George B.",George B. McClellan,George B. McClellan,TRUE,Former Governor of New Jersey,https://encrypted-tbn1.gstatic.com/images?q=tbn:ANd9GcR--td6G-oOiq0zKdGTYIe5q7ATylbsBcJHfJcoobmx94pJUQjy,https://sv.m.wikipedia.org/wiki/Fil:George_B_McClellan_-_retouched.jpg,"George Brinton McClellan was an American soldier, civil engineer, railroad executive, and politician who served as the 24th Governor of New Jersey. ",https://en.wikipedia.org/wiki/George_B._McClellan
365,"Rubens, Peter Paul",Peter Paul Rubens,Peter Paul Rubens,TRUE,Artist,https://encrypted-tbn1.gstatic.com/images?q=tbn:ANd9GcQhHRWF84K7hX_NN9c9Uvb4z2kercmIe2nhS7AGZeV1X9SKGy3m,https://commons.wikimedia.org/wiki/File:Peter_Paul_Rubens_-_Self-Portrait_-_WGA20380.jpg,Sir Peter Paul Rubens was a Flemish artist and diplomat from the Duchy of Brabant in the Southern Netherlands. He is considered the most influential artist of the Flemish Baroque tradition. ,https://en.wikipedia.org/wiki/Peter_Paul_Rubens
366,"Rutherfurd, Lewis Morris",Lewis Morris Rutherfurd,Lewis Morris Rutherfurd,TRUE,American lawyer,https://encrypted-tbn1.gstatic.com/images?q=tbn:ANd9GcRfi5LcqLDjbpgD5NUoTdMiAMex9rWooFHCZiRcmyiUvBIuHSm_,https://zh.m.wikipedia.org/wiki/File:Rutherfurd_Lewis_Morris.jpg,"Lewis Morris Rutherfurd was an American lawyer and astronomer, and a pioneering astrophotographer.",https://en.wikipedia.org/wiki/Lewis_Morris_Rutherfurd
367,"Saint Laurent, Yves",Yves Saint Laurent,Yves Saint Laurent,TRUE,Fashion company,https://encrypted-tbn2.gstatic.com/images?q=tbn:ANd9GcT92Gvm3tHmcfPQxlzt-0il_rY7WJJVRNO9KOooR0RHofw0qd0k,https://de.wikipedia.org/wiki/Datei:Yves_Saint_Laurent_Logo2.svg,"Yves Saint Laurent SAS, also known as Saint Laurent, is a French luxury fashion house founded by Yves Saint Laurent and his partner, Pierre BergÃ©. The company revived its haute couture collection in 2015 under former Creative Director Hedi Slimane. In April 2016, Anthony Vaccarello was appointed as Creative Director.
",https://en.wikipedia.org/wiki/Yves_Saint_Laurent_(brand)
368,"Simmons, Will",Will Simmons,Bill Simmons,FALSE,American sports analyst,https://encrypted-tbn2.gstatic.com/images?q=tbn:ANd9GcShWprgjpN0dt3tD3wAq5iFT20KzjZAeEySd_EuOCIKE51ZRx_D,https://en.wikipedia.org/wiki/Bill_Simmons,"William John Simmons III is an American sports analyst, author, podcaster, and former sports writer who is the founder and CEO of the sports and pop culture website The Ringer. ",https://en.wikipedia.org/wiki/Bill_Simmons
371,"Thomson, Elihu",Elihu Thomson,Elihu Thomson,TRUE,Engineer,https://encrypted-tbn2.gstatic.com/images?q=tbn:ANd9GcQD8vwWn7usMpiXPj59UuKxYpt725kbmIB61j-eYtjKKs4khrzu,https://commons.wikimedia.org/wiki/File:Elihu_Thomson_1853_%E2%80%931937.jpg,"Elihu Thomson was an English-born American engineer and inventor who was instrumental in the founding of major electrical companies in the United States, the United Kingdom and France.",https://en.wikipedia.org/wiki/Elihu_Thomson
372,"Wilson, Nancy",Nancy Wilson,Nancy Wilson,TRUE,American musician,https://encrypted-tbn2.gstatic.com/images?q=tbn:ANd9GcTWp_Lv849-Bvy47gcbVEsLMUlHMluWPukiUb5jONyhxC0qlJjA,https://pt.wikipedia.org/wiki/Ficheiro:Nancy_Wilson_1998.jpg,"Nancy Lamoureaux Wilson is an American musician, singer, songwriter, producer, and film composer. She rose to fame alongside her older sister, singer Ann Wilson, as a guitarist and backing vocalist in the rock band Heart, which she joined in 1974.
",https://en.wikipedia.org/wiki/Nancy_Wilson_(rock_musician)
373,"Alexander, Lamar",Lamar Alexander,Lamar Alexander,TRUE,United States Senator,https://encrypted-tbn0.gstatic.com/images?q=tbn:ANd9GcTW3aQwV9kFekZy1T4N9_VuOdCTlodpHqzcJO7e2WWtGn-wIH5G,https://commons.wikimedia.org/wiki/File:Lamar_Alexander_official_photo.jpg,"Andrew Lamar Alexander Jr. is an American politician who is currently serving as the senior United States Senator from Tennessee, a seat he has held since 2003. ",https://en.wikipedia.org/wiki/Lamar_Alexander
374,"Anderson, John M.",John M. Anderson,Mullet,FALSE,,https://encrypted-tbn2.gstatic.com/images?q=tbn:ANd9GcT474FlaSGIA1peNiURisaVXO2-vTVwNsUo0d4pgCvCQi2VvEfi,https://commons.wikimedia.org/wiki/File:Mulletman.jpg,"The mullet is a hairstyle in which the hair is short at the front and sides, but long at the back. It is usually worn by men.",https://en.wikipedia.org/wiki/Mullet_(haircut)
375,"Beck, Glenn",Glenn Beck,Glenn Beck,TRUE,CEO of TheBlaze,https://encrypted-tbn2.gstatic.com/images?q=tbn:ANd9GcS0MFqCNdYq81ibUx5NOOVJ6VJt4d011Xue89JOblHPxVJBKe47,https://commons.wikimedia.org/wiki/File:Glenn_Beck_(25030472253)_(cropped).jpg,"Glenn Lee Beck is an American conservative political commentator, radio host, television producer, and conspiracy theorist. He is the CEO, founder, and owner of Mercury Radio Arts, the parent company of his television and radio network TheBlaze. ",https://en.wikipedia.org/wiki/Glenn_Beck
377,"Brashear, John A.",John A. Brashear,John Brashear,FALSE,American astronomer,https://encrypted-tbn1.gstatic.com/images?q=tbn:ANd9GcSyDNgEs78jHH3q4y1C4rKVfCqlwArei3rsgaMV54mDKG7_W6KE,https://en.wikipedia.org/wiki/John_Brashear,Dr. John Alfred Brashear was an American astronomer and instrument builder.,https://en.wikipedia.org/wiki/John_Brashear
378,"Bush, Barbara",Barbara Bush,Barbara Bush,TRUE,Former First Lady of the United States,https://encrypted-tbn0.gstatic.com/images?q=tbn:ANd9GcQsrwLiAzo2hx-xOQg1q6ncMUK-2wsP5dAgLwNjpKPiJx57mq0V,https://no.m.wikipedia.org/wiki/Fil:First_Lady_Barbara_Bush.jpg,"Barbara Pierce Bush was the first lady of the United States from 1989 to 1993 as the wife of George H. W. Bush, who served as the 41st president of the United States, and founder of the Barbara Bush Foundation for Family Literacy. ",https://en.wikipedia.org/wiki/Barbara_Bush
383,"Eisenhower, Mamie Doud",Mamie Doud Eisenhower,Mamie Eisenhower,FALSE,Former First Lady of the United States,https://encrypted-tbn1.gstatic.com/images?q=tbn:ANd9GcRIXO8nwILpTMLGK6BMsptfRTdM0XKiAUWyLSEdMbVfdY2jG_03,https://en.wikipedia.org/wiki/File:Mamie_eisenhower.gif,"Mamie Geneva Eisenhower was the wife of President Dwight D. Eisenhower and thereby First Lady of the United States from 1953 to 1961.
Mamie married Dwight Eisenhower at age 19 in 1916. The young couple moved frequently between military quarters in many postings, from Panama to the Philippines. ",https://en.wikipedia.org/wiki/Mamie_Eisenhower
385,"Ferraro, Geraldine O.",Geraldine O. Ferraro,Geraldine Ferraro,FALSE,American Politician,https://encrypted-tbn2.gstatic.com/images?q=tbn:ANd9GcSO5NPH9H-8_ZsHwgoVj7nwlM-KIb06jeXv6DA8ND8sauhQcP5s,https://commons.wikimedia.org/wiki/File:GERALDINE_FERRARO.jpg,"Geraldine Anne ""Gerry"" Ferraro was an American politician, diplomat, and attorney. She served in the United States House of Representatives from 1979 to 1985, and was the Democratic Party's vice presidential nominee in 1984, running alongside former vice president Walter Mondale; making her the first female vice-presidential nominee representing a major American political party. ",https://en.wikipedia.org/wiki/Geraldine_Ferraro
386,"Fitzgerald, Ella",Ella Fitzgerald,Ella Fitzgerald,TRUE,American jazz singer,https://encrypted-tbn0.gstatic.com/images?q=tbn:ANd9GcTiyJM5jpq05OjvcIeMTlrQKs-7mqjKYThgG8MSY9rBUVKZYERe,https://commons.wikimedia.org/wiki/File:Ella_Fitzgerald_1962.JPG,"Ella Jane Fitzgerald was an American jazz singer, sometimes referred to as the First Lady of Song, Queen of Jazz, and Lady Ella. ",https://en.wikipedia.org/wiki/Ella_Fitzgerald
388,"Greatorex, Eliza Pratt",Eliza Pratt Greatorex,Eliza Pratt Greatorex,TRUE,American artist,https://encrypted-tbn2.gstatic.com/images?q=tbn:ANd9GcRbdUez3xaXw8wMBWJ4XFyCQMGXi1NMnSy-qyaM30AwswfQtD1K,https://en.wikipedia.org/wiki/Eliza_Pratt_Greatorex,Eliza Pratt Greatorex was an Irish-born American artist who was affiliated with the Hudson River School. She is known for her landscape paintings as well as for several series of pen-and-ink drawings and etchings that were published in book form. ,https://en.wikipedia.org/wiki/Eliza_Pratt_Greatorex
389,"Hoover, Lou Henry",Lou Henry Hoover,Lou Henry Hoover,TRUE,Former First Lady of the United States,https://encrypted-tbn1.gstatic.com/images?q=tbn:ANd9GcS-j1_FOGCgd4hdeYG66BKVTLGujJmJhedv1UW3-3n8eLFUwNdR,https://commons.wikimedia.org/wiki/File:Lou-Henry-Hoover-WH-Portrait.jpg,"Lou Hoover was the wife of President Herbert Hoover and served as the First Lady of the United States from 1929 to 1933.
Marrying her geologist and mining engineer husband in 1899, she traveled widely with him, including to Shanghai, China, and became a cultivated scholar and linguist. ",https://en.wikipedia.org/wiki/Lou_Henry_Hoover
390,"Horton, Christopher",Christopher Horton,Chris Horton,FALSE,American football safety,https://encrypted-tbn0.gstatic.com/images?q=tbn:ANd9GcSjyMqv2al3TSeVH1yz4G8ENSxXoUMgRAvEQItIVgbVIKc7dJpT,https://en.wikipedia.org/wiki/Chris_Horton,Christopher D. Horton is a former American football safety that is currently the special teams coach for the Baltimore Ravens of the National Football League. He was drafted by the Washington Redskins in the seventh round of the 2008 NFL Draft. He played college football at UCLA.,https://en.wikipedia.org/wiki/Chris_Horton
391,"Japanese, World War II",World War II Japanese,Allies of World War II,FALSE,,https://encrypted-tbn3.gstatic.com/images?q=tbn:ANd9GcQreGfuxPgSw1ZFpTIcmKMMyBKmM8lpSg3CKrO4W5xAsn9eH1vZ,https://en.wikipedia.org/wiki/Allies_of_World_War_II,"The Allies of World War II, called the United Nations from the 1 January 1942 declaration, were the countries that together opposed the Axis powers during the Second World War. ",https://en.wikipedia.org/wiki/Allies_of_World_War_II
392,"Kennedy, Caroline",Caroline Kennedy,Caroline Kennedy,TRUE,American author,https://encrypted-tbn0.gstatic.com/images?q=tbn:ANd9GcQTGoUs6BHk8mDMqpf2jTGJ7tCXVnHUiuTjCFFaUUmsFEek0rv5,https://commons.wikimedia.org/wiki/File:Caroline_Kennedy_US_State_Dept_photo.jpg,"Caroline Bouvier Kennedy is an American author, attorney, and diplomat who served as the United States Ambassador to Japan from 2013 to 2017. She is a member of the Kennedy family and the only surviving child of President John F. Kennedy and First Lady Jacqueline Bouvier Kennedy.
Kennedy was five days shy of her sixth birthday when her father was assassinated on November 22, 1963. The following year, Caroline, her mother, and brother John F. Kennedy Jr. settled on the Upper East Side of Manhattan, where she attended school. ",https://en.wikipedia.org/wiki/Caroline_Kennedy
394,"Nixon, Patricia",Patricia Nixon,Tricia Nixon Cox,FALSE,Richard Nixon's daughter,https://encrypted-tbn3.gstatic.com/images?q=tbn:ANd9GcThO7ZsOOnSPbJQqwXJysc2b3xLUP3rbkc-9Rzaf2e8254v8Dux,https://en.wikipedia.org/wiki/File:Nixon_Contact_Sheet_WHPO-D1055_(cropped).jpg,"Patricia Nixon Cox is the elder daughter of the 37th President Richard Nixon and First Lady Pat Nixon, and sister to Julie Nixon Eisenhower.
She is married to Edward F. Cox and is the mother of Christopher Nixon Cox.
In her father's public career, Cox performed a ceremonial role, in contrast to Julie's more political involvement. She accompanied him on many campaign stops and, after his inauguration, on state trips around the world.",https://en.wikipedia.org/wiki/Tricia_Nixon_Cox
397,"Pelosi, Nancy",Nancy Pelosi,Nancy Pelosi,TRUE,Speaker of the United States House of Representatives,https://encrypted-tbn2.gstatic.com/images?q=tbn:ANd9GcQKPjtddU9dV3rUozVnJABL6u3bc3NCtcCCMdk7ME2qcqVoTEZd,https://commons.wikimedia.org/wiki/File:Official_photo_of_Speaker_Nancy_Pelosi_in_2019.jpg,Nancy Patricia Pelosi is an American politician serving as a congresswoman from California and the Speaker of the United States House of Representatives. ,https://en.wikipedia.org/wiki/Nancy_Pelosi
398,"Perry, Rick",Rick Perry,Rick Perry,TRUE,Former United States Secretary of Energy,https://encrypted-tbn3.gstatic.com/images?q=tbn:ANd9GcTll8sA5fiiInzi8aOCp_hSrJ4ZIZixWoPNTFukLoCXUpaF9MBx,https://ru.m.wikipedia.org/wiki/%D0%A4%D0%B0%D0%B9%D0%BB:Rick_Perry_official_portrait.jpg,"James Richard ""Rick"" Perry is an American politician who served as the 14th United States Secretary of Energy from 2017 to 2019. ",https://en.wikipedia.org/wiki/Rick_Perry
399,"Rankin, Jeannette",Jeannette Rankin,Jeannette Rankin,TRUE,American Politician,https://encrypted-tbn0.gstatic.com/images?q=tbn:ANd9GcTHQxiiY9lynpm-R_PrwTCjoMIRLqgMFKHFVV9wQCSqhzkCtWWO,https://en.wikipedia.org/wiki/Jeannette_Rankin,"Jeannette Pickering Rankin was an American politician and women's rights advocate, and the first woman to hold federal office in the United States. She was elected to the U.S. House of Representatives as a Republican from Montana in 1916, and again in 1940.
",https://en.wikipedia.org/wiki/Jeannette_Rankin
400,"Reagan, Nancy",Nancy Reagan,Nancy Reagan,TRUE,Former First Lady of the United States,https://encrypted-tbn1.gstatic.com/images?q=tbn:ANd9GcQwc8ZmBslkcGg96C5Qokf52FrXttNPYVOxSeegQsFRpw1X1iTG,https://commons.wikimedia.org/wiki/File:Photograph_of_the_Official_Portrait_of_Mrs._Reagan_-_NARA_-_198534.jpg,"Nancy Davis Reagan was an American film actress and the second wife of Ronald Reagan, the 40th president of the United States. She was the first lady of the United States from 1981 to 1989.
She was born in New York City. ",https://en.wikipedia.org/wiki/Nancy_Reagan
403,"Roosevelt, Franklin Delano",Franklin Delano Roosevelt,Franklin D. Roosevelt,FALSE,32nd U.S. President,https://encrypted-tbn2.gstatic.com/images?q=tbn:ANd9GcQuRW16tNmrUvXyKIGV_NUsdhP8oDmpFdJCIKLH4u0UB1RjhZvS,https://commons.wikimedia.org/wiki/File:1944_portrait_of_FDR_(2).jpg,"Franklin Delano Roosevelt, often referred to by his initials FDR, was an American politician who served as the 32nd president of the United States from 1933 until his death in 1945. ",https://en.wikipedia.org/wiki/Franklin_D._Roosevelt
406,"Sanchez, Emilio",Emilio Sanchez,Emilio SÃ¡nchez,FALSE,Tennis player,https://encrypted-tbn0.gstatic.com/images?q=tbn:ANd9GcRl2TcCAgsK1cCmEJDly2NvMLG2kR1cOVjO7oWFY81_JdiKS0jo,https://en.wikipedia.org/wiki/Emilio_S%C3%A1nchez,Emilio Ãngel SÃ¡nchez Vicario is a former world No. 1 doubles professional tennis player from Spain. He won five Grand Slam doubles titles and the men's doubles silver medal at the 1988 Olympic Games. ,https://en.wikipedia.org/wiki/Emilio_S%C3%A1nchez
